"odd_objectif","indicateur_nombre","indicateur_nom","cible_nom","année_courante","valeure_courante","unité_calcul","statut_progrès"
"12","12.6.1","Nombre d’entreprises qui publient des rapports sur le développement durable","Encourager les entreprises, en particulier les grandes entreprises et les sociétés transnationales, à adopter des pratiques viables et à intégrer dans les rapports qu’elles établissent des informations sur la viabilité",NA,NA,NA,"Non disponible"
"12","12.7.1","Degré de mise en œuvre des politiques et plans d’action relatifs aux pratiques durables de passation des marchés publics","Promouvoir des pratiques durables dans le cadre de la passation des marchés publics, conformément aux politiques et priorités nationales",2022,55,"Index","Non disponible"
"12","12.8.1","Degré d’intégration de i) l’éducation à la citoyenneté mondiale et ii) l’éducation au développement durable dans a) les politiques nationales d’éducation, b) les programmes d’enseignement, c) la formation des enseignants et d) l’évaluation des étudiants","D’ici à 2030, faire en sorte que toutes les personnes, partout dans le monde, aient les informations et connaissances nécessaires au développement durable et à un style de vie en harmonie avec la nature",2020,0.88,"Index","Non disponible"
"12","12.a.1","Puissance installée du parc d’énergie renouvelable dans les pays en développement (en watts par habitant)","Aider les pays en développement à se doter des moyens scientifiques et technologiques qui leur permettent de s’orienter vers des modes de consommation et de production plus durables",NA,NA,NA,"Non disponible"
"12","12.b.1","Application des outils comptables usuels au suivi des aspects économiques et écologiques du tourisme durable","Mettre au point et utiliser des outils de contrôle de l’impact sur le développement durable d’un tourisme durable créateur d’emplois et valorisant la culture et les produits locaux",2021,6,"Number of tables compiled","Détérioration"
"12","12.c.1","Montant des subventions aux combustibles fossiles par unité de PIB (production et consommation)","Rationaliser les subventions aux combustibles fossiles qui sont source de gaspillage, grâce à l’élimination des distorsions du marché, eu égard au contexte national, y compris au moyen de la restructuration de la fiscalité et de la suppression progressive des subventions préjudiciables qui sont en place, en mettant en évidence leur impact sur l’environnement, en tenant pleinement compte des besoins et de la situation propres aux pays en développement et en réduisant au minimum les éventuels effets négatifs sur le développement de ces pays tout en protégeant les pauvres et les populations concernées.",NA,NA,NA,"Non disponible"
"13","13.1.1","Nombre de personnes décédées, disparues ou directement touchées lors de catastrophes, pour 100 000 personnes","Renforcer, dans tous les pays, la résilience et les capacités d’adaptation face aux aléas climatiques et aux catastrophes naturelles liées au climat",2020,35.38,NA,"Sur la bonne voie"
"13","13.1.2","Stratégies nationales de réduction des risques de catastrophe conformes au Cadre d'action de Sendai pour la réduction des risques de catastrophe (2015-2030) qui ont été adoptées et implémentées","Renforcer, dans tous les pays, la résilience et les capacités d’adaptation face aux aléas climatiques et aux catastrophes naturelles liées au climat",NA,NA,NA,"Cible atteinte"
"13","13.1.3","Administrations locales ayant adopté et mis en place des stratégies locales de réduction des risques de catastrophe, conformément aux stratégies suivies à l’échelle nationale","Renforcer, dans tous les pays, la résilience et les capacités d’adaptation face aux aléas climatiques et aux catastrophes naturelles liées au climat",NA,NA,NA,"Cible atteinte"
"13","13.2.1","Nombre de pays ayant prévu des contributions déterminées au niveau national, des stratégies à long terme, des plans nationaux d’adaptation ou des stratégies, tel qu’il ressort des communications relatives à l’adaptation et des communications nationales","Incorporer des mesures relatives aux changements climatiques dans les politiques, les stratégies et la planification nationales",NA,NA,NA,"Non disponible"
"13","13.2.2","Total des émissions annuelles de gaz à effet de serre","Incorporer des mesures relatives aux changements climatiques dans les politiques, les stratégies et la planification nationales",NA,NA,"Megatonnes of carbon dioxide equivalent (Mt CO2 eq)","Non disponible"
"13","13.3.1","Degré d’intégration de i) l’éducation à la citoyenneté mondiale et ii) l’éducation au développement durable dans a) les politiques nationales d’éducation, b) les programmes d’enseignement, c) la formation des enseignants et d) l’évaluation des étudiants","Améliorer l’éducation, la sensibilisation et les capacités individuelles et institutionnelles en ce qui concerne l’adaptation aux changements climatiques, l’atténuation de leurs effets et la réduction de leur impact et les systèmes d’alerte rapide",2020,0.88,"Index","Non disponible"
"13","13.a.1","Montant (en dollars des États-Unis) des ressources fournies et mobilisées par année relativement à l’objectif collectif actuel de mobilisation, soit 100 milliards de dollars jusqu’en 2025","Mettre en œuvre l’engagement que les pays développés parties à la Convention-cadre des Nations Unies sur les changements climatiques ont pris de mobiliser ensemble auprès de multiples sources 100 milliards de dollars par an d’ici à 2020 pour répondre aux besoins des pays en développement en ce qui concerne les mesures concrètes d’atténuation et la transparence de leur mise en œuvre et rendre le Fonds vert pour le climat pleinement opérationnel en le dotant dans les plus brefs délais des moyens financiers nécessaires",2020,763.41,"US dollar (millions)","Sur la bonne voie"
"13","13.b.1","Nombre de pays les moins avancés et de petits États insulaires en développement ayant prévu des contributions déterminées au niveau national, des stratégies à long terme, des plans nationaux d’adaptation ou des stratégies, tel qu’il ressort des communications relatives à l’adaptation et des communications nationales","Promouvoir des mécanismes de renforcement des capacités afin que les pays les moins avancés et les petits États insulaires en développement se dotent de moyens efficaces de planification et de gestion pour faire face aux changements climatiques, l’accent étant mis, notamment, sur les femmes, les jeunes, la population locale et les groupes marginalisés",NA,NA,NA,"Non disponible"
"14","14.1.1","a) Indicateur du potentiel d’eutrophisation côtière (ICEP) et b) densité des débris de plastiques","D’ici à 2025, prévenir et réduire nettement la pollution marine de tous types, en particulier celle résultant des activités terrestres, y compris les déchets en mer et la pollution par les nutriments",NA,NA,NA,"Non disponible"
"14","14.2.1","Nombre de pays appliquant des approches écosystémiques à la gestion des zones marines","D’ici à 2020, gérer et protéger durablement les écosystèmes marins et côtiers, notamment en renforçant leur résilience, afin d’éviter les graves conséquences de leur dégradation et prendre des mesures en faveur de leur restauration pour rétablir la santé et la productivité des océans",NA,NA,NA,"Non disponible"
"14","14.3.1","Acidité moyenne des mers (pH) mesurée à plusieurs points de prélèvement représentatifs","Réduire au maximum l’acidification des océans et lutter contre ses effets, notamment en renforçant la coopération scientifique à tous les niveaux",NA,NA,NA,"Non disponible"
"14","14.4.1","Proportion de stocks de poissons dont le niveau est biologiquement viable","D’ici à 2020, réglementer efficacement la pêche, mettre un terme à la surpêche, à la pêche illicite, non déclarée et non réglementée et aux pratiques de pêche destructrices et exécuter des plans de gestion fondés sur des données scientifiques, l’objectif étant de rétablir les stocks de poissons le plus rapidement possible, au moins à des niveaux permettant d’obtenir un rendement constant maximal compte tenu des caractéristiques biologiques",2023,97.49,"Percentage (%)","Des progrès ont été réalisés, mais une accélération est nécessaire"
"14","14.5.1","Surface des aires marines protégées, en proportion de la surface totale","D’ici à 2020, préserver au moins 10 pour cent des zones marines et côtières, conformément au droit national et international et compte tenu des meilleures informations scientifiques disponibles",2023,14.7,"Percentage (%)","Cible atteinte"
"14","14.6.1","État d’avancement de la mise en œuvre des instruments
internationaux visant à combattre la pêche illicite, non déclarée et non réglementée","D’ici à 2020, interdire les subventions à la pêche qui
contribuent à la surcapacité et à la surpêche, supprimer celles qui favorisent la
pêche illicite, non déclarée et non réglementée et s’abstenir d’en accorder de nouvelles,
sachant que l’octroi d’un traitement spécial et différencié efficace et approprié
aux pays en développement et aux pays les moins avancés doit faire partie intégrante
des négociations sur les subventions à la pêche menées dans le cadre de l’Organisation
mondiale du commerce.",NA,NA,NA,"Non disponible"
"14","14.7.1","Proportion du PIB correspondant aux activités de pêche viables dans les petits États insulaires en développement, les pays les moins avancés et tous les pays","D’ici à 2030, faire bénéficier plus largement les petits États insulaires en développement et les pays les moins avancés des retombées économiques de l’exploitation durable des ressources marines, notamment grâce à une gestion durable des pêches, de l’aquaculture et du tourisme",NA,NA,NA,"Non disponible"
"14","14.a.1","Proportion du budget total de la recherche allouée à la recherche sur les techniques marines","Approfondir les connaissances scientifiques, renforcer les moyens de recherche et transférer les techniques marines, conformément aux Critères et principes directeurs de la Commission océanographique intergouvernementale concernant le transfert de techniques marines, l’objectif étant d’améliorer la santé des océans et de renforcer la contribution de la biodiversité marine au développement des pays en développement, en particulier des petits États insulaires en développement et des pays les moins avancés",NA,NA,NA,"Non disponible"
"14","14.b.1","État d’avancement de la mise en œuvre d’un
cadre juridique, réglementaire, politique ou institutionnel reconnaissant et protégeant
les droits d’accès des petits pêcheurs","Garantir aux petits pêcheurs l’accès aux ressources marines
et aux marchés",NA,NA,NA,"Non disponible"
"14","14.c.1","Nombre de pays progressant dans la ratification, l’acceptation et la mise en œuvre, au moyen de cadres juridiques, opérationnels et institutionnels, des instruments relatifs aux océans visant à donner effet aux dispositions du droit international énoncées dans la Convention des Nations Unies sur le droit de la mer qui concernent la conservation et de l’utilisation durable des océans et de leurs ressources","Améliorer la conservation et l’utilisation durable des océans et de leurs ressources en application des dispositions du droit international, énoncées dans la Convention des Nations Unies sur le droit de la mer, qui fournit le cadre juridique requis pour la conservation et l’utilisation durable des océans et de leurs ressources, comme il est rappelé au paragraphe 158 de « L’avenir que nous voulons »",NA,NA,NA,"Non disponible"
"15","15.1.1","Surface des zones forestières, en proportion de la surface terrestre","D’ici à 2020, garantir la préservation, la restauration et l’exploitation durable des écosystèmes terrestres et des écosystèmes d’eau douce et des services connexes, en particulier des forêts, des zones humides, des montagnes et des zones arides, conformément aux obligations découlant des accords internationaux",NA,NA,"Percentage (%)","Non disponible"
"15","15.1.2","Proportion des sites importants pour la biodiversité terrestre et la biodiversité des eaux douces qui se trouvent dans des aires protégées (par type d’écosystème)","D’ici à 2020, garantir la préservation, la restauration et l’exploitation durable des écosystèmes terrestres et des écosystèmes d’eau douce et des services connexes, en particulier des forêts, des zones humides, des montagnes et des zones arides, conformément aux obligations découlant des accords internationaux",2023,29.2,"Percentage (%)","Progrès limités"
"15","15.2.1","Progrès vers la gestion durable des forêts","D’ici à 2020, promouvoir la gestion durable de tous les types de forêt, mettre un terme à la déforestation, restaurer les forêts dégradées et accroître nettement le boisement et le reboisement au niveau mondial",2020,90.43,"Percentage (%)","Progrès limités"
"15","15.3.1","Surface des terres dégradées, en proportion de la surface terrestre","D’ici à 2030, lutter contre la désertification, restaurer les terres et sols dégradés, notamment les terres touchées par la désertification, la sécheresse et les inondations, et s’efforcer de parvenir à un monde sans dégradation des terres",2019,11.72,"Percentage (%)","Détérioration"
"15","15.4.1","Sites importants pour la biodiversité des montagnes qui se trouvent dans des aires protégées","D’ici à 2030, assurer la préservation des écosystèmes montagneux, notamment de leur biodiversité, afin de mieux tirer parti de leurs bienfaits essentiels pour le développement durable",2023,34.94,"Percentage (%)","Progrès limités"
"15","15.4.2","Indice de couvert végétal montagneux","D’ici à 2030, assurer la préservation des écosystèmes montagneux, notamment de leur biodiversité, afin de mieux tirer parti de leurs bienfaits essentiels pour le développement durable",NA,NA,NA,"Non disponible"
"15","15.5.1","Indice des espèces canadiennes","Prendre d’urgence des mesures énergiques pour réduire la dégradation du milieu naturel, mettre un terme à l’appauvrissement de la biodiversité et, d’ici à 2020, protéger les espèces menacées et prévenir leur extinction",NA,NA,"Cumulative percentage change since 1970","Non disponible"
"15","15.6.1","Les cadres législatifs, administratifs et politiques du Canada pour assurer un partage juste et équitable des bénéfices","Favoriser le partage juste et équitable des bénéfices découlant de l’utilisation des ressources génétiques et promouvoir un accès approprié à celles-ci, ainsi que cela a été décidé à l’échelle internationale",NA,NA,NA,"Non disponible"
"15","15.7.1","Proportion du braconnage et du trafic illicite dans le commerce des espèces de faune et de flore sauvages","Prendre d’urgence des mesures pour mettre un terme au braconnage et au trafic d’espèces végétales et animales protégées et s’attaquer au problème sous l’angle de l’offre et de la demande",NA,NA,NA,"Non disponible"
"15","15.8.1","L'adoption d'une législation nationale et l'affectation de ressources adéquates à la prévention et au contrôle des espèces exotiques envahissantes par le Canada","Proportion de pays ayant adopté une législation nationale pertinente et allouant des ressources suffisantes à la prévention ou au contrôle des espèces exotiques envahissantes",NA,NA,NA,"Cible atteinte"
"15","15.9.1","a) Nombre de pays qui ont établi des objectifs nationaux conformément ou de manière semblable à l’objectif 2 d’Aichi pour la biodiversité du Plan stratégique pour la diversité biologique 2011-2020 dans leurs stratégies et plans d’action nationaux pour la biodiversité et progrès accomplis dans la réalisation de ces objectifs, et b) intégration de la biodiversité aux systèmes de comptabilité et d’information financière, définie comme la mise en œuvre du Système de comptabilité environnementale et économique","D’ici à 2020, intégrer la protection des écosystèmes et de la biodiversité dans la planification nationale, dans les mécanismes de développement, dans les stratégies de réduction de la pauvreté et dans la comptabilité",NA,NA,NA,"Non disponible"
"15","15.a.1","a) Aide publique au développement consacrée à la préservation et à l’exploitation durable de la biodiversité et b) produits générés et fonds mobilisés par les instruments économiques en rapport avec la biodiversité","Mobiliser des ressources financières de toutes provenances et les augmenter nettement pour préserver la biodiversité et les écosystèmes et les exploiter durablement",2023,34.85,NA,"Sur la bonne voie"
"15","15.b.1","a) Aide publique au développement consacrée à la préservation et à l’exploitation durable de la biodiversité et b) produits générés et fonds mobilisés par les instruments économiques en rapport avec la biodiversité","Mobiliser d’importantes ressources de toutes provenances et à tous les niveaux pour financer la gestion durable des forêts et inciter les pays en développement à privilégier ce type de gestion, notamment aux fins de la préservation des forêts et du reboisement",2023,34.85,NA,"Sur la bonne voie"
"15","15.c.1","Proportion du braconnage et du trafic illicite dans le commerce des espèces de faune et de flore sauvages","Apporter, à l’échelon mondial, un soutien accru à l’action menée pour lutter contre le braconnage et le trafic d’espèces protégées, notamment en donnant aux populations locales d’autres moyens d’assurer durablement leur subsistance",NA,NA,NA,"Non disponible"
"16","16.1.1","Nombre de victimes d’homicide volontaire pour 100 000 habitants, par sexe et âge","Réduire nettement, partout dans le monde, toutes les formes de violence et les taux de mortalité qui y sont associés",2024,1.91,"Rate per 100,000 population","Détérioration"
"16","16.1.2","Nombre de décès liés à des conflits pour 100 000 habitants, par sexe, âge et cause","Réduire nettement, partout dans le monde, toutes les formes de violence et les taux de mortalité qui y sont associés",NA,NA,NA,"Non disponible"
"16","16.1.3","Proportion de la population victime de violences a) physiques, b) psychologiques ou c) sexuelles au cours des 12 mois précédents","Réduire nettement, partout dans le monde, toutes les formes de violence et les taux de mortalité qui y sont associés",2019,46,"Rate per 1,000 population","Progrès limités"
"16","16.1.4","Nombre de personnes considérant qu’il n’y a pas de danger à se déplacer seules à pied dans leur zone de résidence, en proportion de la population totale","Réduire nettement, partout dans le monde, toutes les formes de violence et les taux de mortalité qui y sont associés",2022,79,"Percentage (%)","Progrès limités"
"16","16.2.1","Proportion de la population âgée de 15 et plus ayant subi des agressions physiques ou sexuelles avant l'âge de 15 ans","Mettre un terme à la maltraitance, à l’exploitation et à la traite, et à toutes les formes de violence et de torture dont sont victimes les enfants",2018,27.04,"Percentage (%)","Non disponible"
"16","16.2.2","Nombre d'incidents liés à la traite des êtres humains signalés pour 100 000 habitants","Mettre un terme à la maltraitance, à l’exploitation et à la traite, et à toutes les formes de violence et de torture dont sont victimes les enfants",2024,1.47,"Rate per 100,000 population","Détérioration"
"16","16.2.3","Proportion de jeunes femmes et hommes ayant été victimes de violences sexuelles avant l’âge de 15 ans","Mettre un terme à la maltraitance, à l’exploitation et à la traite, et à toutes les formes de violence et de torture dont sont victimes les enfants",2018,3.14,"Percentage (%)","Non disponible"
"16","16.3.1","Proportion des personnes victimes de violence (a) physique, (b) psychologique et/ou (c) sexuelle au cours des 12 mois précédents ayant signalé les faits aux autorités compétentes ou recouru à d’autres mécanismes de règlement des différends officiellement reconnus","Promouvoir l'état de droit dans l'ordre interne et international et garantir à tous un égal accès à la justice",2019,36,"Percentage (%)","Progrès limités"
"16","16.3.2","Proportion de la population carcérale en instance de jugement","Promouvoir l’état de droit dans l’ordre interne et international et garantir à tous un égal accès à la justice",2023,49.86,"Percentage (%)","Détérioration"
"16","16.3.3","Proportion de la population ayant connu un différend au cours des trois dernières années, avec saisine d’un mécanisme formel ou informel de règlement des différends","Promouvoir l’état de droit dans l’ordre interne et international et garantir à tous un égal accès à la justice",2018,65.9,"Percentage (%)","Non disponible"
"16","16.4.1","Valeur totale des flux financiers illicites entrants et sortants (en dollars des États-Unis courants)","D’ici à 2030, réduire nettement les flux financiers illicites et le trafic d’armes, renforcer les activités de récupération et de restitution des biens volés et lutter contre toutes les formes de criminalité organisée",NA,NA,NA,"Non disponible"
"16","16.4.2","Proportion des armes saisies, trouvées ou rendues volontairement dont la provenance ou l’utilisation illicite a été retracée ou établie par des autorités compétentes, conformément aux instruments internationaux","D’ici à 2030, réduire nettement les flux financiers illicites et le trafic d’armes, renforcer les activités de récupération et de restitution des biens volés et lutter contre toutes les formes de criminalité organisée",NA,NA,NA,"Non disponible"
"16","16.5.1","Proportion de personnes ayant eu, au moins une fois, affaire à un agent public auquel elles ont versé un pot-de-vin ou qui leur a demandé un pot-de-vin au cours des 12 mois précédents","Réduire nettement la corruption et la pratique des pots-de-vin sous toutes leurs formes",NA,NA,NA,"Non disponible"
"16","16.5.2","Proportion d’entreprises ayant eu au moins une fois affaire à un agent public auquel elles ont versé un pot-de-vin ou qui leur a demandé un pot-de-vin au cours des 12 mois précédents","Réduire nettement la corruption et la pratique des pots-de-vin sous toutes leurs formes",NA,NA,NA,"Non disponible"
"16","16.6.1","Dépenses publiques primaires en proportion du budget initial approuvé, par secteur (ou par code budgétaire ou autre critère similaire)","Mettre en place des institutions efficaces, responsables et transparentes à tous les niveaux",2023,109.7,"Percentage (%)","Détérioration"
"16","16.6.2","Proportion de la population dont la dernière expérience avec les services publics a été satisfaisante","Mettre en place des institutions efficaces, responsables et transparentes à tous les niveaux",NA,NA,NA,"Non disponible"
"16","16.7.1","Répartition des postes dans les institutions nationales et locales, y compris : a) les organes législatifs ; b) la fonction publique ; et c) les organes judiciaires, par rapport à la répartition nationale, par sexe, âge, situation au regard du handicap et groupe de population","Faire en sorte que le dynamisme, l’ouverture, la participation et la représentation à tous les niveaux caractérisent la prise de décisions",NA,NA,NA,"Non disponible"
"16","16.7.2","Proportion de la population ayant une grande confiance envers certaines institutions gouvernementales","Faire en sorte que le dynamisme, l’ouverture, la participation et la représentation à tous les niveaux caractérisent la prise de décisions",2020,44.4,"Percentage (%)","Non disponible"
"16","16.8.1","Proportion de pays en développement qui sont membres d’organisations internationales et y disposent du droit de vote","Élargir et renforcer la participation des pays en développement aux institutions chargées de la gouvernance au niveau mondial",NA,NA,NA,"Non disponible"
"16","16.9.1","Proportion d’enfants de moins de 5 ans ayant été enregistrés par une autorité d’état civil, par âge","D’ici à 2030, garantir à tous une identité juridique, notamment grâce à l’enregistrement des naissances",NA,NA,"Percentage (%)","Cible atteinte"
"16","16.10.1","Nombre de cas avérés de meurtres, d’enlèvements, de disparitions forcées, de détentions arbitraires et d’actes de torture dont ont été victimes des journalistes, des personnes travaillant dans les médias, des syndicalistes et des défenseurs des droits de l’homme au cours des 12 mois précédents","Garantir l’accès public à l’information et protéger les libertés fondamentales, conformément à la législation nationale et aux accords internationaux",NA,NA,NA,"Non disponible"
"16","16.10.2","L'adoption et la mise en œuvre des dispositions constitutionnelles, réglementaires et politiques pour garantir l'accès public à l'information au Canada","Garantir l’accès public à l’information et protéger les libertés fondamentales, conformément à la législation nationale et aux accords internationaux",2023,7.5,"Score","Détérioration"
