"odd_objectif","indicateur_nombre","indicateur_nom","cible_nom","année_courante","valeure_courante","unité_calcul","statut_progrès"
"3","3.b.2","Montant total net de l’aide publique au développement consacré à la recherche médicale et aux soins de santé de base.","Appuyer la recherche et le développement de vaccins et de médicaments contre les maladies, transmissibles ou non, qui touchent principalement les habitants des pays en développement, donner accès, à un coût abordable, aux médicaments et vaccins essentiels, conformément à la Déclaration de Doha sur l’Accord sur les aspects des droits de propriété intellectuelle qui touchent au commerce (ADPIC) et la santé publique, qui réaffirme le droit qu’ont les pays en développement de tirer pleinement parti des dispositions de cet accord qui ménagent une flexibilité lorsqu’il s’agit de protéger la santé publique et, en particulier, d’assurer l’accès universel aux médicaments.",2023,436.24,NA,"Sur la bonne voie"
"3","3.d.2","Pourcentage de septicémies causées par un organisme résistant aux antimicrobiens donné","Renforcer les moyens dont disposent tous les pays, en particulier les pays en développement, en matière d’alerte rapide, de réduction des risques et de gestion des risques sanitaires nationaux et mondiaux.",NA,NA,NA,"Non disponible"
"3","3.b.3","Proportion des établissements de santé disposant constamment d’un ensemble de médicaments essentiels à un coût abordable","Appuyer la recherche et le développement de vaccins et de médicaments contre les maladies, transmissibles ou non, qui touchent principalement les habitants des pays en développement, donner accès, à un coût abordable, aux médicaments et vaccins essentiels, conformément à la Déclaration de Doha sur l’Accord sur les aspects des droits de propriété intellectuelle qui touchent au commerce (ADPIC) et la santé publique, qui réaffirme le droit qu’ont les pays en développement de tirer pleinement parti des dispositions de cet accord qui ménagent une flexibilité lorsqu’il s’agit de protéger la santé publique et, en particulier, d’assurer l’accès universel aux médicaments.",NA,NA,NA,"Non disponible"
"4","4.1.1","Proportion d’enfants et de jeunes b) en fin de cycle primaire ; et c) âgés de 15 ans qui maîtrisent au moins les normes d’aptitudes minimales en i) lecture et ii) mathématiques","D’ici à 2030, faire en sorte que toutes les filles et tous les garçons suivent, sur un pied d’égalité, un cycle complet d’enseignement primaire et secondaire gratuit et de qualité, les dotant d’acquis véritablement utiles.",2023,65,"Percentage (%)","Progrès limités"
"4","4.1.2","Niveau de scolarité de la population âgée de 25 à 64 ans, selon le groupe d'âge et le sexe","D’ici à 2030, faire en sorte que toutes les filles et tous les garçons suivent, sur un pied d’égalité, un cycle complet d’enseignement primaire et secondaire gratuit et de qualité, les dotant d’acquis véritablement utiles.",2021,91,"Percentage (%)","Des progrès ont été réalisés, mais une accélération est nécessaire"
"4","4.2.1","Proportion d'enfants âgés de 24 à 59 mois dont le développement est en bonne voie en matière de santé, d'apprentissage et de bien-être psychosocial, par sexe","D’ici à 2030, faire en sorte que toutes les filles et tous les garçons aient accès à des services de développement et de prise en charge de la petite enfance et à une éducation préscolaire de qualité qui les préparent à suivre un enseignement primaire.",NA,NA,NA,"Non disponible"
"4","4.2.2","Taux de participation à des activités d’apprentissage organisées (un an avant l’âge officiel de scolarisation dans le primaire), par sexe.","D’ici à 2030, faire en sorte que toutes les filles et tous les garçons aient accès à des services de développement et de prise en charge de la petite enfance et à une éducation préscolaire de qualité qui les préparent à suivre un enseignement primaire.",2020,93,"Percentage (%)","Détérioration"
"4","4.3.1","Taux de participation de la population âgée 15 à 34 ans à un programme d’éducation et de formation scolaire","D'ici à 2030, faire en sorte que toutes les femmes et tous les hommes aient accès dans des conditions d'égalité à un enseignement technique, professionnel ou tertiaire, y compris universitaire, de qualité et d'un coût abordable",2024,84,"Percentage (%)","Progrès limités"
"4","4.4.1","Proportion d'utilisateurs d'internet ayant des compétences dans le domaine des technologies de l’information et des communications, par type de compétence","D'ici à 2030, augmenter nettement le nombre de jeunes et d'adultes disposant des compétences, notamment techniques et professionnelles, nécessaire à l'emploi, à l'obtention d'un travail décent et à l'entrepreneuriat",2018,63,"Percentage (%)","Non disponible"
"4","4.5.1","Indices de parité (femmes/hommes, urbain/rural, quintile inférieur/supérieur de richesse et autres paramètres tels que le handicap, le statut d’autochtone et les situations de conflit, à mesure que les données deviennent disponibles) pour tous les indicateurs dans le domaine de l’éducation de cette liste pouvant être ventilés","d'ici 2030, éliminer les disparités entre les sexes dans l'enseignement et assurer aux personnes vulnérables, notamment aux personnes handicapées, aux populations autochtones et aux enfants en situation vulnérable, l'égalité d'accès à tous les niveaux d'enseignement et de formation professionnelle.",2017,1,NA,"Des progrès ont été réalisés, mais une accélération est nécessaire"
"4","4.6.1","Proportion de la population âgée de 16 ou plus ayant les compétences voulues à au moins un niveau d’aptitude fixé a) en alphabétisme et b) arithmétique fonctionnels","D’ici à 2030, faire en sorte que tous les jeunes et une proportion considérable d’adultes, hommes et femmes, sachent lire, écrire et compter.",2022,45.9,"Percentage (%)","Détérioration"
"4","4.7.1","Degré d’intégration de i) l’éducation à la citoyenneté mondiale et ii) l’éducation au développement durable dans a) les politiques nationales d’éducation, b) les programmes d’enseignement, c) la formation des enseignants et d) l’évaluation des étudiants","D’ici 2030, veiller à ce que tous les apprenants acquièrent les connaissances et les compétences nécessaires pour promouvoir le développement durable, y compris, entre autres, par l’éducation au développement durable et aux modes de vie durables, les droits de l’homme, l’égalité des sexes, par la promotion d’une culture de paix et de non-violence, par la citoyenneté mondiale et par l’appréciation de la diversité culturelle et de la contribution de la culture au développement durable",2020,0.88,"Index","Non disponible"
"4","4.a.1","Proportion d’établissements scolaires offrant des services essentiels, par type de service","Construire des établissements scolaires qui soient adaptés aux enfants, aux personnes handicapées et aux deux sexes ou adapter les établissements existants à cette fin et fournir à tous un cadre d’apprentissage sûr, non violent, inclusif et efficace",2023,86.81,"Percentage (%)","Sur la bonne voie"
"4","4.b.1","Volume de l’aide publique au développement consacrée aux bourses d’études, par secteur et type de formation","D’ici 2020, augmenter nettement à l’échelle mondiale le nombre de bourses d’études offertes à des étudiants des pays en développement, en particulier des pays les moins avancés, des petits États insulaires en développement et des pays d’Afrique, pour leur permettre de suivre des études supérieures, y compris une formation professionnelle, des cursus informatiques, techniques et scientifiques et des études d’ingénieur, dans des pays développés et d’autres pays en développement",2023,5.94,"US dollar (millions)","Détérioration"
"4","4.c.1","Proportion d'enseignants possédant les qualifications minimales requises, par niveau d’études","D’ici à 2030, accroître nettement le nombre d’enseignants qualifiés, notamment au moyen de la coopération internationale pour la formation d’enseignants dans les pays en développement, surtout dans les pays les moins avancés et les petits États insulaires en développement",NA,NA,NA,"Cible atteinte"
"5","5.1.1","Indicateur 5.1.1 : Cadre juridique du Canada visant à promouvoir, faire respecter et suivre l’application des principes d’égalité des sexes et de non-discrimination fondée sur le sexe","Mettre fin, partout dans le monde, à toutes les formes de discrimination à l’égard des femmes et des filles",NA,NA,NA,"Non disponible"
"5","5.2.1","Proportion de femmes et de filles âgées de 15 ans ou plus ayant vécu en couple victimes de violences physiques, sexuelles ou psychologiques infligées au cours des 12 mois précédents par leur partenaire actuel ou un ancien partenaire, par forme de violence et par âge","Éliminer de la vie publique et de la vie privée toutes les formes de violence faite aux femmes et aux filles, y compris la traite et l’exploitation sexuelle et d’autres types d’exploitation",2018,12.1,"Percentage (%)","Non disponible"
"5","5.2.2","Indicateur 5.2.2 : Proportion de femmes et de filles âgées de 15 ans ou plus victimes de violences sexuelles infligées au cours des 12 mois précédents","Éliminer de la vie publique et de la vie privée toutes les formes de violence faite aux femmes et aux filles, y compris la traite et l’exploitation sexuelle et d’autres types d’exploitation",2018,2.9,"Percentage (%)","Non disponible"
"5","5.3.1","Proportion de femmes âgées de 20 à 24 ans qui étaient mariées ou en couple avant l’âge de 15 ans ou de 18 ans","Éliminer toutes les pratiques préjudiciables, telles que le mariage des enfants, le mariage précoce ou forcé et la mutilation génitale féminine",NA,NA,NA,"Non disponible"
"5","5.3.2","Proportion de filles et de femmes âgées de 15 à 49 ans ayant subi une mutilation ou une ablation génitale, par âge","Éliminer toutes les pratiques préjudiciables, telles que le mariage des enfants, le mariage précoce ou forcé et la mutilation génitale féminine",NA,NA,NA,"Non disponible"
"5","5.4.1","Proportion du temps consacré à des soins et travaux domestiques non rémunérés, par sexe, âge et lieu de résidence","Prendre en compte et valoriser les soins et travaux domestiques non rémunérés, par la mise en place de services publics, d’infrastructures et de politiques de protection sociale et par la promotion du partage des responsabilités dans le ménage et la famille, en fonction du contexte national",2022,1.43,"Percentage (%)","Progrès limités"
"5","5.5.1","Proportion de sièges occupés par des femmes dans a) les parlements nationaux et b) les administrations locales.","Veiller à ce que les femmes participent pleinement et effectivement aux fonctions de direction à tous les niveaux de décision, dans la vie politique, économique et publique, et y accèdent sur un pied d’égalité.",2023,69.4,"Percentage (%)","Progrès limités"
"5","5.5.2","Proportion de femmes occupant des postes de direction.","Veiller à ce que les femmes participent pleinement et effectivement aux fonctions de direction à tous les niveaux de décision, dans la vie politique, économique et publique, et y accèdent sur un pied d’égalité.",2024,63.6,"Percentage (%)","Progrès limités"
"5","5.6.1","Proportion de femmes âgées de 15 à 49 ans prenant, en connaissance de cause, leurs propres décisions concernant leurs relations sexuelles, l’utilisation de contraceptifs et les soins de santé procréative","Assurer l’accès de tous aux soins de santé sexuelle et procréative et faire en sorte que chacun puisse exercer ses droits en matière de procréation, ainsi qu’il a été décidé dans le Programme d’action de la Conférence internationale sur la population et le développement et le Programme d’action de Beijing et les documents finals des conférences d’examen qui ont suivi",NA,NA,NA,"Non disponible"
"5","5.6.2","Nombre de pays dotés de textes législatifs et réglementaires garantissant aux femmes et aux hommes de 15 ans ou plus un accès équitable et sans restriction aux soins de santé sexuelle et procréative, ainsi qu’à des informations et une éducation dans ce domaine","Assurer l’accès de tous aux soins de santé sexuelle et procréative et faire en sorte que chacun puisse exercer ses droits en matière de procréation, ainsi qu’il a été décidé dans le Programme d’action de la Conférence internationale sur la population et le développement et le Programme d’action de Beijing et les documents finals des conférences d’examen qui ont suivi",NA,NA,NA,"Non disponible"
"5","5.a.1","a) Proportion de la population agricole totale ayant des droits de propriété ou des droits garantis sur des terres agricoles, par sexe ; b) proportion de femmes parmi les titulaires de droits de propriété ou de droits garantis sur des terrains agricoles, par type de droit","Entreprendre des réformes visant à donner aux femmes les mêmes droits aux ressources économiques, ainsi que l’accès à la propriété et au contrôle des terres et d’autres formes de propriété, aux services financiers, à l’héritage et aux ressources naturelles, dans le respect de la législation interne",NA,NA,NA,"Non disponible"
"5","5.b.1","Proportion de ménages qui possèdent un téléphone mobile","Renforcer l’utilisation des technologies clefs, en particulier de l’informatique et des communications, pour favoriser l’autonomisation des femmes",2023,95.7,"Percentage (%)","Sur la bonne voie"
"5","5.c.1","Systèmes canadiens permettant de suivre et de rendre public le montant des ressources allouées à l’égalité des sexes et à l’autonomisation des femmes","Adopter des politiques bien conçues et des dispositions législatives applicables en faveur de la promotion de l’égalité des sexes et de l’autonomisation de toutes les femmes et de toutes les filles à tous les niveaux et renforcer celles qui existent",NA,NA,NA,"Cible atteinte"
"5","5.a.2","Indicateur: Indicateur 5.a.2 : Cadre juridique (y compris le droit coutumier) du Canada garantissant aux femmes les mêmes droits que les hommes en matière d’accès à la propriété ou au contrôle des terres","Entreprendre des réformes visant à donner aux femmes les mêmes droits aux ressources économiques, ainsi que l’accès à la propriété et au contrôle des terres et d’autres formes de propriété, aux services financiers, à l’héritage et aux ressources naturelles, dans le respect de la législation interne",NA,NA,NA,"Non disponible"
"6","6.1.1","Proportion de la population utilisant des services d'alimentation en eau potable gérés en toute sécurité.","D'ici à 2030, assurer l'accès universel et équitable à l'eau potable, à un coût abordable.",2022,99.04,"Percentage (%)","Progrès limités"
"6","6.2.1","Proportion de la population utilisant a) des services d’assainissement gérés en toute sécurité et b) notamment des équipements pour se laver les mains avec de l’eau et du savon.","D’ici à 2030, assurer l’accès de tous, dans des conditions équitables, à des services d’assainissement et d’hygiène adéquats et mettre fin à la défécation en plein air, en accordant une attention particulière aux besoins des femmes et des filles et des personnes en situation vulnérable.",NA,NA,NA,"Non disponible"
"6","6.3.1","Proportion des eaux usées d’origine municipale et de la fabrication traitées sans danger","D’ici à 2030, améliorer la qualité de l’eau en réduisant la pollution, en éliminant l’immersion de déchets et en réduisant au minimum les émissions de produits chimiques et de matières dangereuses, en diminuant de moitié la proportion d’eaux usées non traitées et en augmentant nettement à l’échelle mondiale le recyclage et la réutilisation sans danger de l’eau",2021,43.13,NA,"Progrès limités"
"6","6.3.2","Proportion de rivières canadiennes dont la qualité de l'eau ambiante est bonne à excellente","D’ici à 2030, améliorer la qualité de l’eau en réduisant la pollution, en éliminant l’immersion de déchets 
et en réduisant au minimum les émissions de produits chimiques et de matières dangereuses, en diminuant de moitié la 
proportion d’eaux usées non traitées et en augmentant nettement à l’échelle mondiale le recyclage et la réutilisation 
sans danger de l’eau",2021,49,"Percentage (%)","Sur la bonne voie"
"6","6.4.1","Variation de l’efficacité de l’utilisation des ressources en eau","D’ici à 2030, faire en sorte que les ressources en eau soient utilisées beaucoup plus efficacement dans tous les secteurs et garantir la viabilité des prélèvements et de l’approvisionnement en eau douce afin de remédier à la pénurie d’eau et de réduire nettement le nombre de personnes qui manquent d’eau",2021,45.56,NA,"Sur la bonne voie"
"6","6.4.2","Niveau de stress hydrique : prélèvements d’eau douce en proportion des ressources en eau douce disponibles","D’ici à 2030, faire en sorte que les ressources en eau soient utilisées beaucoup plus efficacement dans tous les secteurs et garantir la viabilité des prélèvements et de l’approvisionnement en eau douce afin de remédier à la pénurie d’eau et de réduire nettement le nombre de personnes qui manquent d’eau",2021,3.73,"Percentage (%)","Cible atteinte"
"6","6.5.1","Degré de mise en œuvre de la gestion intégrée des ressources en eau","D’ici à 2030, assurer la gestion intégrée des ressources en eau à tous les niveaux, y compris au moyen de la coopération transfrontière selon qu’il convient",2023,73,"Percentage (%)","Non disponible"
"6","6.5.2","Proportion de bassins hydriques transfrontaliers où est en place un dispositif de coopération opérationnel","Cible 6.5 : D’ici à 2030, assurer la gestion intégrée des ressources en eau à tous les niveaux, y compris au moyen de la coopération transfrontière selon qu’il convient",2021,80.22,"Percentage (%)","Non disponible"
"6","6.6.1","Variation de l’étendue des écosystèmes tributaires de l’eau","D’ici à 2020, protéger et restaurer les écosystèmes liés à l’eau, notamment les montagnes, les forêts, les zones humides, les rivières, les aquifères et les lacs",NA,NA,"Percentage (%)","Non disponible"
"6","6.a.1","Montant de l’aide publique au développement consacrée à l’eau et à l’assainissement dans un plan de dépenses coordonné par les pouvoirs publics","D’ici à 2030, développer la coopération internationale et l’appui au renforcement des capacités des pays en développement en ce qui concerne les activités et programmes relatifs à l’eau et à l’assainissement, y compris la collecte, la désalinisation et l’utilisation rationnelle de l’eau, le traitement des eaux usées, le recyclage et les techniques de réutilisation",2023,31.98,NA,"Détérioration"
"6","6.b.1","Proportion d’administrations locales ayant mis en place des politiques et procédures opérationnelles encourageant la participation de la population locale à la gestion de l’eau et de l’assainissement","Appuyer et renforcer la participation de la population locale à l’amélioration de la gestion de l’eau et de l’assainissement",NA,NA,NA,"Non disponible"
"7","7.1.1","Proportion de la population ayant accès à l’électricité","D’ici à 2030, garantir l’accès de tous à des services énergétiques fiables et modernes, à un coût abordable.",2023,100,"Percentage (%)","Cible atteinte"
"7","7.1.2","Proportion de la population utilisant principalement des carburants et technologies propres.","D’ici à 2030, garantir l’accès de tous à des services énergétiques fiables et modernes, à un coût abordable.",2022,100,"Percentage (%)","Cible atteinte"
"7","7.2.1","Proportion de l’électricité produite à partir de sources renouvelables et autres sources non émettrices de gaz à effet de serre","D’ici à 2030, accroître nettement la part de l’énergie renouvelable dans le bouquet énergétique mondial.",2024,79.4,"Percentage (%)","Détérioration"
"7","7.3.1","Intensité totale de la consommation d’énergie en termes de PIB","D’ici à 2030, multiplier par deux le taux mondial d’amélioration de l’efficacité énergétique",2023,4.75,"Terajoules per million dollars of real GDP","Progrès limités"
"7","7.a.1","Flux financiers internationaux à destination des pays en développement à l’appui de la recherche-développement dans le domaine des énergies propres et de la production d’énergie renouvelable, notamment au moyen de systèmes hybrides","D’ici à 2030, renforcer la coopération internationale en vue de faciliter l’accès aux sciences et technologies de l’énergie propre, notamment les énergies renouvelables, l’efficacité énergétique et les nouvelles technologies de combustion propre des combustibles fossiles, et encourager l’investissement dans l’infrastructure énergétique et les technologies propres dans le domaine de l’énergie",2023,285.59,NA,"Sur la bonne voie"
"7","7.b.1","Puissance installée du parc d’énergie renouvelable dans les pays en développement (en watts par habitant)","D’ici à 2030, développer l’infrastructure et améliorer la technologie afin de fournir des services énergétiques modernes et durables à tous les habitants des pays en développement, en particulier des pays les moins avancés, des petits États insulaires en développement et des pays en développement sans littoral, dans le respect des programmes d’aide qui les concernent",NA,NA,NA,"Non disponible"
"8","8.1.1","Taux de croissance annuelle du PIB réel par habitant","Maintenir un taux de croissance économique par habitant adapté au contexte national et, en particulier, un taux de croissance annuelle du produit intérieur brut d’au moins 7 pour cent dans les pays les moins avancés.",2024,59529.12,"Percentage (%)","Progrès limités"
"8","8.2.1","Taux de croissance annuelle du PIB réel par personne pourvue d'un emploi","Parvenir à un niveau élevé de productivité économique par la diversification, la modernisation technologique et l'innovation, notamment en mettant l'accent sur les secteurs à forte valeur ajoutée et à forte intensité de main-d'oeuvre",2024,118487735.46,"Percentage (%)","Progrès limités"
"8","8.3.1","Proportion de l’emploi informel dans l’emploi total, par secteur et par sexe","Promouvoir des politiques axées sur le développement qui favorisent les activités productives, la création d’emplois décents, l’entrepreneuriat, la créativité et l’innovation et stimulent la croissance des microentreprises et des petites et moyennes entreprises et facilitent leur intégration dans le secteur formel, y compris par l’accès aux services financiers",NA,NA,NA,"Non disponible"
"8","8.4.1","Empreinte matérielle, empreinte matérielle par habitant et empreinte matérielle par unité de PIB","Améliorer progressivement, jusqu’en 2030, l’efficacité de l’utilisation des ressources mondiales dans les modes de consommation et de production et s’attacher à dissocier croissance économique et dégradation de l’environnement, comme prévu dans le Cadre décennal de programmation concernant les modes de consommation et de production durables, les pays développés montrant l’exemple en la matière",NA,NA,"Tonnes (million)","Non disponible"
"8","8.4.2","Consommation matérielle nationale, consommation matérielle nationale par habitant et consommation matérielle nationale par unité de PIB","Améliorer progressivement, jusqu’en 2030, l’efficacité de l’utilisation des ressources mondiales dans les modes de consommation et de production et s’attacher à dissocier croissance économique et dégradation de l’environnement, comme prévu dans le Cadre décennal de programmation concernant les modes de consommation et de production durables, les pays développés montrant l’exemple en la matière",NA,NA,"Tonnes (million)","Non disponible"
"8","8.5.1","Rémunération horaire moyenne des salariés, par sexe, profession, âge et situation au regard du handicap","D’ici à 2030, parvenir au plein emploi productif et garantir à toutes les femmes et à tous les hommes, y compris les jeunes et les personnes handicapées, un travail décent et un salaire égal pour un travail de valeur égale",2024,35.2,"Canadian dollars ($)","Sur la bonne voie"
"8","8.5.2","Taux de chômage, par sexe, âge et situation au regard du handicap","D’ici à 2030, parvenir au plein emploi productif et garantir à toutes les femmes et à tous les hommes, y compris les jeunes et les personnes handicapées, un travail décent et un salaire égal pour un travail de valeur égale",2024,6.3,"Percentage (%)","Progrès limités"
"8","8.6.1","Proportion de jeunes (âgés de 15 à 24 ans) non scolarisés et sans emploi ni formation","D’ici à 2020, réduire nettement la proportion de jeunes non scolarisés et sans emploi ni formation",2025,10,"Percentage (%)","Des progrès ont été réalisés, mais une accélération est nécessaire"
